{
  "$schema": "./ownership.schema.json",
  "schema_version": 1,
  "supported_hosts": [
    "codex",
    "hermes",
    "omp"
  ],
  "capabilities": [
    {
      "id": "breadcrumb-records",
      "owner": "skills/breadcrumb-records",
      "status": "admitted",
      "selection_state": "selected",
      "selection_evidence": [
        "evals/results/breadcrumb-records-deterministic.json",
        "evals/results/project-lifecycle-2026-10-05.json"
      ],
      "selection_reason": "User selected the existing continuity owner for proportionate project promotion, organization, handoff and recoverable closeout, with a short managed standing trigger. Local helper and native Codex association checks passed; two explicitly loaded fresh-agent tasks exercised small work, promotion and independent continuation. This does not establish natural triggering, universal quality or Hermes/OMP parity. No watcher, provider or memory change is selected."
    },
    {
      "id": "capability-curator",
      "owner": "skills/capability-curator",
      "status": "staged",
      "selection_state": "unresolved",
      "selection_evidence": [],
      "selection_reason": "Current Hermes and Codex lanes both ended in independently verified harness failures. Their sealed 90-attempt budgets cannot contain another complete 72-attempt run, and the aggregate is inconclusive, so the owner remains staged and undeployed."
    },
    {
      "id": "primary-source-research",
      "owner": "skills/primary-source-research",
      "status": "staged",
      "selection_state": "unresolved",
      "selection_evidence": [],
      "selection_reason": "Staged owner only; no best-candidate admission decision has been made."
    },
    {
      "id": "learn-from-youtube",
      "owner": "skills/learn-from-youtube",
      "status": "admitted",
      "selection_state": "selected",
      "selection_evidence": [
        "evals/results/learn-from-youtube-deterministic.json"
      ],
      "selection_reason": "Selected as a behavior-level synthesis: Agent Sync provenance and parser, Hermes AI LABS extraction, OMP routing, and Codex UI metadata; inferior copied policy and generated caches are excluded."
    },
    {
      "id": "neuroarxiv",
      "owner": "skills/neuroarxiv",
      "status": "retired",
      "selection_state": "unresolved",
      "selection_evidence": [],
      "selection_reason": "Consolidated into project-prior-art at user request. The detailed arXiv reading method remains available as an optional reference, without the former novelty gate or mandatory paper fan-out."
    },
    {
      "id": "project-prior-art",
      "owner": "skills/project-prior-art",
      "status": "admitted",
      "selection_state": "selected",
      "selection_evidence": [
        "evals/results/project-prior-art-deterministic.json"
      ],
      "selection_reason": "User requested reuse-first research for any new project, with GitHub as implementation evidence and arXiv as a source of novel mechanisms. The short owner preserves a conditional paper-reading reference and avoids a fixed research itinerary. Structural checks do not establish output-quality improvement."
    },
    {
      "id": "advise-project-approach",
      "owner": "skills/advise-project-approach",
      "status": "retired",
      "selection_state": "unresolved",
      "selection_evidence": [],
      "selection_reason": "Retired by user request: the general architecture checklist adds context and can oversteer capable models. Project decisions remain with the task and relevant domain owners."
    },
    {
      "id": "answer-key-gauntlet",
      "owner": "skills/answer-key-gauntlet",
      "status": "admitted",
      "selection_state": "selected",
      "selection_evidence": [
        "evals/results/answer-key-gauntlet-deterministic.json"
      ],
      "selection_reason": "The Hermes, Codex, and retired bridge variants were semantically identical; Agent Sync preserves the workflow and contract while replacing stale bridge ownership."
    },
    {
      "id": "frontend-ui-engineering",
      "owner": "skills/frontend-ui-engineering",
      "status": "admitted",
      "selection_state": "selected",
      "selection_evidence": [
        "evals/results/frontend-ui-engineering-deterministic.json",
        "evals/results/frontend-design-synthesis-2026-09-13.json",
        "evals/results/frontend-image-workflow-2026-10-09.json",
        "evals/results/frontend-case-clarifications-2026-10-09.json",
        "evals/results/frontend-representation-contract-2026-10-09.json",
        "evals/results/frontend-reference-bound-review-2026-10-09.json",
        "evals/results/frontend-delivery-consumer-2026-10-10.json",
        "evals/results/frontend-ui-engineering-loading-20261014.json"
      ],
      "selection_reason": "Original admission preserved the byte-identical shared/Codex engineering baseline and MIT provenance. The source revision integrates bounded Anthropic, Impeccable, and Hallmark design-judgment findings without adding frontend owners; source and decision-probe evidence does not establish visual-quality, personal-taste, or cross-host behavioral superiority. Candidate deployment status is recorded in the follow-up receipt. The user approved the 5.0.0 image-led new-identity/major-redesign procedure after whole-page, reference-family and second-product trials; routine repairs reuse approved identity. Portable receipt records source checks and bounded evidence without claiming causal quality, cost or host parity. The user-authorized 2026-10-14 reconciliation retains the capability and narrows loading to its applicable work.",
      "purpose": {
        "objective": "Deliver frontend experiences that fulfill the brief with coherent ordinary behavior and painted quality before human taste selection.",
        "added_value": "Project-independent regression cases and source-bound delivery acceptance connect rendered findings to retained commitments, recovery and whole-product readiness. Native models and browser tools still supply discovery and judgment; comparative generation-quality benefit is unproven.",
        "retirement_test": "Use the current model and native tools without this skill on comparable new builds and revisions. Retire the whole skill when that path preserves ordinary-path discovery, reference commitments, source-bound defect acceptance, transport and human review at acceptable total cost, with any necessary system integration owned elsewhere."
      }
    },
    {
      "id": "surface-convergence",
      "owner": "skills/surface-convergence",
      "status": "staged",
      "selection_state": "unresolved",
      "selection_evidence": [],
      "selection_reason": "Staged owner only; no best-candidate admission decision has been made."
    },
    {
      "id": "cross-agent-surface-engineering",
      "owner": "skills/cross-agent-surface-engineering",
      "status": "admitted",
      "selection_state": "selected",
      "selection_evidence": [
        "evals/results/cross-agent-surface-engineering-deterministic.json"
      ],
      "selection_reason": "Selected as a behavior-level synthesis of the current Agent Sync operator, useful host-discovery checks, and one shared Agent Skills deployment; stale bridge ownership and retired-host rules were rejected."
    },
    {
      "id": "outcome-first-workflow-design",
      "owner": "skills/outcome-first-workflow-design",
      "status": "admitted",
      "selection_state": "selected",
      "selection_evidence": [
        "evals/results/organic-architecture-governance-2026-08-25.json",
        "evals/results/behavior-contract-audit-20261010.json"
      ],
      "selection_reason": "Retains the recorded admission with stated evaluation limits: structural checks passed, cross-host discovery was partial, and one value-dependent Hermes probe completed. The normal-build probe began implementation but exceeded the harness ceiling; the isolated A/B was inconclusive, and OMP natural-trigger behavior was not sampled. The linked receipt does not establish completed held-out evaluation or cross-host behavioral validation. The user-selected 2026-10-10 audit procedure reconstructs behavior clusters from existing evidence before focused human clarification; its receipt proves metadata/report mechanics, not improved model quality or parity.",
      "purpose": {
        "objective": "Choose AI workflow mechanisms that achieve the intended human outcome within the user's constraints. This purpose is inferred from the existing contract and the user's explicit outcome-first research requirement.",
        "added_value": "Connects structural failures to Agent Sync's research, implementation, acceptance and reversible promotion owners. General first-principles advice may be redundant with current models; comparative output-quality and cost benefits remain unproven.",
        "retirement_test": "Use the current model and native tools without this skill on comparable workflow design and structural repair tasks. Retire the skill when that path preserves outcome reconstruction, credible researched alternatives, fault detection, authorization and recovery at acceptable total cost, with necessary Agent Sync integration owned elsewhere."
      }
    },
    {
      "id": "openai-delegation-route-research",
      "owner": "skills/openai-delegation-route-research",
      "status": "admitted",
      "selection_state": "selected",
      "selection_evidence": [
        "evals/results/openai-delegation-route-research-deterministic.json"
      ],
      "selection_reason": "Admitted as the current portable research/selection owner after deterministic selector, schema, and live-adapter boundary verification; retired compatibility surfaces are excluded."
    },
    {
      "id": "dynamic-workflows",